{
  "schema_version": "0.1.0",
  "tool_registry_version": "0.1.0",
  "id": "bp_earthquake_list_recent_001",
  "user_goal": "Son 24 saatte meydana gelen, büyüklüğü 3,0 veya daha yüksek en fazla 10 depremi öğrenmek",
  "available_tools": [
    "earthquake_list_recent"
  ],
  "tool_required": true,
  "provided_parameters": {
    "hours": 24,
    "min_magnitude": 3,
    "limit": 10
  },
  "missing_parameters": [],
  "expected_behavior": "tool_call",
  "expected_tool_calls": [
    {
      "function": {
        "name": "earthquake_list_recent",
        "arguments": {
          "hours": 24,
          "min_magnitude": 3,
          "limit": 10
        }
      }
    }
  ],
  "execution_order": "not_applicable",
  "expected_tool_result": {
    "source": "AFAD",
    "retrieved_at": "2026-08-11T09:00:00Z",
    "count": 1,
    "events": [
      {
        "event_id": "evt-000001",
        "occurred_at": "2026-08-11T08:15:00Z",
        "latitude": 38.0,
        "longitude": 25.5,
        "depth_km": 7.2,
        "magnitude": 3.4,
        "magnitude_type": "ML",
        "location": "Ege Denizi"
      }
    ]
  },
  "expected_final_behavior": "Bulunan depremleri, verinin kaynağını ve alınma zamanını belirterek kısa ve anlaşılır biçimde sunmak; bu bilgileri güncel bir acil durum duyurusu olarak yorumlamamak.",
  "must_avoid": [
    "Verinin alınma zamanını, bilgilerin hâlâ güncel olduğunun kanıtı gibi göstermek.",
    "Araç çıktısında yer almayan hasar veya güvenlik bilgileri eklemek."
  ],
  "metadata": {
    "main_category": "single_tool",
    "secondary_tags": [],
    "difficulty": "easy",
    "source_type": "original_turkish",
    "domain": "earthquake",
    "intended_execution_type": "mock",
    "provenance": {
      "source_dataset": "afad_contract_synthetic_v1",
      "source_example_id": "earthquake.afad.list_recent.v1",
      "upstream_source": "https://deprem.afad.gov.tr/event-service",
      "source_split": null,
      "transformation_history": [
        {
          "action": "normalized_to_candidate_contract",
          "timestamp": "2026-08-11T09:00:00Z",
          "actor_id": null,
          "details": "Kişisel veri içermeyen ve her çalıştırmada aynı sonucu veren bir örnek oluşturuldu."
        }
      ],
      "generator_model": null,
      "generator_version": null,
      "license": null,
      "license_chain": []
    }
  }
}
